{
  "settingId": "spuk_im_schlosskeller",
  "bereich": "gespraech",
  "hinweis": "Tischgespräche Runde 3, Besetzungsplätze 1 bis 4 (A-051): je Rolle eines, Stichpunkte statt Prosa, ohne den Detektiv.",
  "eintraege": [
    {
      "id": "g_ahmet_3_1",
      "rolle": "ahmet",
      "runde": 3,
      "nr": 1,
      "partner": "aylin",
      "thema": "Bis zum Morgen",
      "ziel": "Ich will, dass beim Geld niemand nachhakt.",
      "preisgabe": [
        "luege:luege_ahmet_miete"
      ],
      "stichpunkte": [
        "Das Geld war für die Miete.",
        "Wir sitzen eh bis zum Morgen fest.",
        "Hältst du zu mir?"
      ]
    },
    {
      "id": "g_fatma_3_1",
      "rolle": "fatma",
      "runde": 3,
      "nr": 1,
      "partner": "emine",
      "thema": "Bist du auf meiner Seite?",
      "ziel": "Ich will jemanden finden, der zu mir hält.",
      "preisgabe": [
        "luege:luege_fatma_buffet"
      ],
      "stichpunkte": [
        "Egal was kommt, ich halte zu dir.",
        "Ich war die ganze Zeit beim Gebäck."
      ]
    },
    {
      "id": "g_olli_3_1",
      "rolle": "olli",
      "runde": 3,
      "nr": 1,
      "partner": "hakan",
      "thema": "Herr Schneider beim Geld",
      "ziel": "Ich will wissen, wie Herr Schneider bei Ärger reagiert.",
      "preisgabe": [],
      "stichpunkte": [
        "Wie reagiert Herr Schneider bei Geldfragen?",
        "Ich pack gern mit an, wo es klemmt."
      ]
    },
    {
      "id": "g_can_3_1",
      "rolle": "can",
      "runde": 3,
      "nr": 1,
      "partner": "zeynep",
      "thema": "Halt zu mir",
      "ziel": "Ich will, dass mich niemand verrät.",
      "preisgabe": [
        "luege:luege_can_toilette"
      ],
      "stichpunkte": [
        "Ich war die ganze Zeit oben im Turm.",
        "Bitte halt zu mir."
      ]
    }
  ]
}
