{
  "settingId": "spuk_im_schlosskeller",
  "bereich": "gespraech",
  "hinweis": "Tischgespräche Runde 1, Besetzungsplätze 17 bis 20 (A-051): je Rolle eines, Stichpunkte statt Prosa, ohne den Detektiv.",
  "eintraege": [
    {
      "id": "g_enes_1_1",
      "rolle": "enes",
      "runde": 1,
      "nr": 1,
      "partner": "serkan",
      "thema": "Wer hielt sich an der Theke auf?",
      "ziel": "Ich will wissen, ob jemand an der Theke etwas bemerkt hat.",
      "preisgabe": [],
      "stichpunkte": [
        "Ich koch heute für alle Tee.",
        "Hast du beim Knall jemanden gesehen?"
      ]
    },
    {
      "id": "g_selin_1_1",
      "rolle": "selin",
      "runde": 1,
      "nr": 1,
      "partner": "ahmet",
      "thema": "Wo warst du, als das Licht ausging?",
      "ziel": "Ich will wissen, wo andere waren, als das Licht ausging.",
      "preisgabe": [],
      "stichpunkte": [
        "Laute Geräusche erschrecken mich.",
        "Wo warst du, als das Licht ausging?"
      ]
    },
    {
      "id": "g_hakan_1_1",
      "rolle": "hakan",
      "runde": 1,
      "nr": 1,
      "partner": "kaan",
      "thema": "Herr Schneider und das Geld",
      "ziel": "Ich will das Gespräch über Herrn Schneiders Geld bremsen.",
      "preisgabe": [
        "beobachtung:b_pawel_schneider"
      ],
      "stichpunkte": [
        "Lass Herrn Schneider beim Geld in Ruhe.",
        "Er muss jeden Schaden der Stiftung melden."
      ]
    },
    {
      "id": "g_tugba_1_1",
      "rolle": "tugba",
      "runde": 1,
      "nr": 1,
      "partner": "johanna",
      "thema": "Wer fehlt auf meiner Liste?",
      "ziel": "Ich will wissen, wo die fehlenden Leute angeblich sind.",
      "preisgabe": [
        "beobachtung:b_tugba_notiz"
      ],
      "stichpunkte": [
        "Ich hab notiert, wer gerade fehlt.",
        "Wo warst du beim Knall?"
      ]
    }
  ]
}
