{
  "settingId": "spuk_im_schlosskeller",
  "bereich": "gespraech",
  "hinweis": "Tischgespräche Runde 1, Besetzungsplätze 13 bis 16 (A-051): je Rolle eines, Stichpunkte statt Prosa, ohne den Detektiv.",
  "eintraege": [
    {
      "id": "g_serkan_1_1",
      "rolle": "serkan",
      "runde": 1,
      "nr": 1,
      "partner": "selin",
      "thema": "Am Außentor beim Knall",
      "ziel": "Ich will wissen, wer beim Knall wo war.",
      "preisgabe": [
        "beobachtung:b_serkan_tor"
      ],
      "stichpunkte": [
        "Ich stand ab kurz vor zwölf am Außentor.",
        "Das Tor war zu, keiner ist raus.",
        "Wo warst du beim Knall?"
      ]
    },
    {
      "id": "g_aylin_1_1",
      "rolle": "aylin",
      "runde": 1,
      "nr": 1,
      "partner": "dilara",
      "thema": "Wer war am Buffet?",
      "ziel": "Ich will wissen, wer kurz vor zwölf am Buffet stand.",
      "preisgabe": [],
      "stichpunkte": [
        "Ich heb jeden Beleg auf.",
        "Wer war kurz vor zwölf am Buffet?"
      ]
    },
    {
      "id": "g_kaan_1_1",
      "rolle": "kaan",
      "runde": 1,
      "nr": 1,
      "partner": "zeynep",
      "thema": "Das Maßband im Dunkeln",
      "ziel": "Ich will wissen, wer beim Knall etwas mitbekommen hat.",
      "preisgabe": [],
      "stichpunkte": [
        "Mein Maßband hilft im Dunkeln gar nicht.",
        "Wo warst du beim Knall?"
      ]
    },
    {
      "id": "g_dilara_1_1",
      "rolle": "dilara",
      "runde": 1,
      "nr": 1,
      "partner": "hakan",
      "thema": "Was war am Buffet los?",
      "ziel": "Ich will wissen, wer am Buffet etwas mitbekommen hat.",
      "preisgabe": [],
      "stichpunkte": [
        "Ich stöbere sonst auf Flohmärkten.",
        "Was hast du am Buffet mitbekommen?"
      ]
    }
  ]
}
