{
  "settingId": "spuk_im_schlosskeller",
  "bereich": "gespraech",
  "hinweis": "Tischgespräche Runde 1, Besetzungsplätze 5 bis 8 (A-051): je Rolle eines, Stichpunkte statt Prosa, ohne den Detektiv.",
  "eintraege": [
    {
      "id": "g_leyla_1_1",
      "rolle": "leyla",
      "runde": 1,
      "nr": 1,
      "partner": "fatma",
      "thema": "Das Buffet beim Knall",
      "ziel": "Ich will wissen, wer beim Knall am Buffet war.",
      "preisgabe": [],
      "stichpunkte": [
        "Ich hab das Buffet für heute geplant.",
        "Wer stand beim Knall am Buffet?"
      ]
    },
    {
      "id": "g_emine_1_1",
      "rolle": "emine",
      "runde": 1,
      "nr": 1,
      "partner": "olli",
      "thema": "Die Theke beim Knall",
      "ziel": "Ich will wissen, wer beim Knall an der Theke war.",
      "preisgabe": [],
      "stichpunkte": [
        "Ich hab mich beim Knall furchtbar erschrocken.",
        "Wer war da an der Theke?"
      ]
    },
    {
      "id": "g_tim_1_1",
      "rolle": "tim",
      "runde": 1,
      "nr": 1,
      "partner": "murat",
      "thema": "Das leuchtende Gesicht",
      "ziel": "Ich will wissen, wer im Dunkeln noch etwas gesehen hat.",
      "preisgabe": [
        "beobachtung:b_tim_gesicht"
      ],
      "stichpunkte": [
        "Ich war am Sicherungskasten, als es dunkel wurde.",
        "Da huschte ein leuchtendes Gesicht vorbei.",
        "Hast du das auch gesehen?"
      ]
    },
    {
      "id": "g_johanna_1_1",
      "rolle": "johanna",
      "runde": 1,
      "nr": 1,
      "partner": "meryem",
      "thema": "Die Fotos des Abends",
      "ziel": "Ich will wissen, wer beim Knall wo war.",
      "preisgabe": [],
      "stichpunkte": [
        "Ich bin heute die Fotografin.",
        "Wo warst du beim Knall?"
      ]
    }
  ]
}
