{
  "settingId": "spuk_im_schlosskeller",
  "bereich": "gespraech",
  "hinweis": "Tischgespräche Runde 1, Besetzungsplätze 1 bis 4 (A-051): je Rolle eines, Stichpunkte statt Prosa, ohne den Detektiv.",
  "eintraege": [
    {
      "id": "g_ahmet_1_1",
      "rolle": "ahmet",
      "runde": 1,
      "nr": 1,
      "partner": "aylin",
      "thema": "Das Geld für die Miete",
      "ziel": "Ich will wissen, ob jemand am Geld zweifelt.",
      "preisgabe": [
        "luege:luege_ahmet_miete"
      ],
      "stichpunkte": [
        "Die hundertfünfzig Euro waren für die Miete.",
        "Hast du beim Knall etwas mitbekommen?"
      ]
    },
    {
      "id": "g_fatma_1_1",
      "rolle": "fatma",
      "runde": 1,
      "nr": 1,
      "partner": "enes",
      "thema": "Wo hast du beim Knall gestanden?",
      "ziel": "Ich will wissen, was andere beim Knall gesehen haben.",
      "preisgabe": [
        "luege:luege_fatma_buffet"
      ],
      "stichpunkte": [
        "Ich stand die ganze Zeit am linken Buffet.",
        "Und wo warst du, als es knallte?"
      ]
    },
    {
      "id": "g_olli_1_1",
      "rolle": "olli",
      "runde": 1,
      "nr": 1,
      "partner": "tugba",
      "thema": "Wo warst du, als es knallte?",
      "ziel": "Ich will wissen, ob man mich am Tisch gesehen hat.",
      "preisgabe": [
        "luege:luege_olli_tafel"
      ],
      "stichpunkte": [
        "Ich saß die ganze Zeit im Ost-Saal.",
        "Und wo warst du beim Knall?"
      ]
    },
    {
      "id": "g_can_1_1",
      "rolle": "can",
      "runde": 1,
      "nr": 1,
      "partner": "tim",
      "thema": "Was hast du im Dunkeln gesehen?",
      "ziel": "Ich will wissen, ob jemand im Dunkeln etwas gesehen hat.",
      "preisgabe": [
        "luege:luege_can_toilette"
      ],
      "stichpunkte": [
        "Ich war die ganze Zeit auf der Toilette.",
        "Was hast du im Dunkeln gesehen?"
      ]
    }
  ]
}
