{
  "settingId": "spuk_im_schlosskeller",
  "bereich": "gespraech",
  "hinweis": "Tischgespräche Runde 2, Besetzungsplätze 1 bis 4 (A-051): je Rolle eines, Stichpunkte statt Prosa, ohne den Detektiv.",
  "eintraege": [
    {
      "id": "g_ahmet_2_1",
      "rolle": "ahmet",
      "runde": 2,
      "nr": 1,
      "partner": "olli",
      "thema": "Wer war wo?",
      "ziel": "Ich will hören, ob die Geschichten zusammenpassen.",
      "preisgabe": [],
      "stichpunkte": [
        "Ich hab den Abend organisiert, nicht bewacht.",
        "Wer stand beim Knall in deiner Nähe?"
      ]
    },
    {
      "id": "g_fatma_2_1",
      "rolle": "fatma",
      "runde": 2,
      "nr": 1,
      "partner": "ahmet",
      "thema": "Meine Version",
      "ziel": "Ich will bei meiner Version bleiben, ohne dass jemand nachhakt.",
      "preisgabe": [
        "luege:luege_fatma_buffet"
      ],
      "stichpunkte": [
        "Beim Gebäck am linken Buffet war ich.",
        "Passt das zu deiner Geschichte?"
      ]
    },
    {
      "id": "g_olli_2_1",
      "rolle": "olli",
      "runde": 2,
      "nr": 1,
      "partner": "can",
      "thema": "Wie es Herrn Schneider geht",
      "ziel": "Ich will wissen, was man über Herrn Schneider weiß.",
      "preisgabe": [],
      "stichpunkte": [
        "Wie geht es Herrn Schneider eigentlich?",
        "Weißt du was Genaues oder nur Gerede?"
      ]
    },
    {
      "id": "g_can_2_1",
      "rolle": "can",
      "runde": 2,
      "nr": 1,
      "partner": "kaan",
      "thema": "Die Maske",
      "ziel": "Ich will hören, ob jemand von einer Maske redet.",
      "preisgabe": [
        "luege:luege_can_maske"
      ],
      "stichpunkte": [
        "Welche Maske? Ich hab keine Maske.",
        "Wer erzählt denn so was?"
      ]
    }
  ]
}
