{
  "settingId": "spuk_im_schlosskeller",
  "bereich": "gespraech",
  "hinweis": "Tischgespräche Runde 2, Besetzungsplätze 9 bis 12 (A-051): je Rolle eines, Stichpunkte statt Prosa, ohne den Detektiv.",
  "eintraege": [
    {
      "id": "g_murat_2_1",
      "rolle": "murat",
      "runde": 2,
      "nr": 1,
      "partner": "tim",
      "thema": "Am Buffet beim Knall",
      "ziel": "Ich will prüfen, ob die Geschichten vom Buffet zusammenpassen.",
      "preisgabe": [],
      "stichpunkte": [
        "Was war am Buffet los im Dunkeln?",
        "Passt das zu dem, was du sagst?"
      ]
    },
    {
      "id": "g_zeynep_2_1",
      "rolle": "zeynep",
      "runde": 2,
      "nr": 1,
      "partner": "fatma",
      "thema": "Kurz vor zwölf",
      "ziel": "Ich will Geschichten von kurz vor zwölf prüfen.",
      "preisgabe": [],
      "stichpunkte": [
        "Wo warst du kurz vor zwölf?",
        "Stimmt das so, wie du es erzählst?"
      ]
    },
    {
      "id": "g_baran_2_1",
      "rolle": "baran",
      "runde": 2,
      "nr": 1,
      "partner": "hakan",
      "thema": "Die Minuten nach dem Knall",
      "ziel": "Ich will prüfen, ob die Geschichten nach dem Knall stimmen.",
      "preisgabe": [],
      "stichpunkte": [
        "Meine Musik lief bis zum Knall.",
        "Was hast du danach gemacht?"
      ]
    },
    {
      "id": "g_meryem_2_1",
      "rolle": "meryem",
      "runde": 2,
      "nr": 1,
      "partner": "johanna",
      "thema": "Der Kamin zieht nicht",
      "ziel": "Ich will jemanden finden, der beim Kamin hilft.",
      "preisgabe": [],
      "stichpunkte": [
        "Holz kenn ich gut, Kaminzüge weniger.",
        "Kannst du mir beim Kamin helfen?"
      ]
    }
  ]
}
