{
  "settingId": "spuk_im_schlosskeller",
  "bereich": "gespraech",
  "hinweis": "Tischgespräche Runde 2, Besetzungsplätze 13 bis 16 (A-051): je Rolle eines, Stichpunkte statt Prosa, ohne den Detektiv.",
  "eintraege": [
    {
      "id": "g_serkan_2_1",
      "rolle": "serkan",
      "runde": 2,
      "nr": 1,
      "partner": "meryem",
      "thema": "Wer wollte raus?",
      "ziel": "Ich will wissen, ob im Dunkeln jemand raus wollte.",
      "preisgabe": [],
      "stichpunkte": [
        "Ich fahr nachher alle sicher heim.",
        "Wollte im Dunkeln jemand raus?"
      ]
    },
    {
      "id": "g_aylin_2_1",
      "rolle": "aylin",
      "runde": 2,
      "nr": 1,
      "partner": "baran",
      "thema": "Genau erzählen",
      "ziel": "Ich will genau wissen, wer wo stand, ohne über Geld zu reden.",
      "preisgabe": [],
      "stichpunkte": [
        "Im Dunkeln sieht man nicht viel.",
        "Wie genau weißt du, wer wo stand?"
      ]
    },
    {
      "id": "g_kaan_2_1",
      "rolle": "kaan",
      "runde": 2,
      "nr": 1,
      "partner": "zeynep",
      "thema": "Olli nach dem Knall",
      "ziel": "Ich will wissen, ob jemand Olli nach dem Knall gesehen hat.",
      "preisgabe": [],
      "stichpunkte": [
        "Nach dem Knall lag alles im Dunkeln.",
        "Hast du Olli da irgendwo gesehen?"
      ]
    },
    {
      "id": "g_dilara_2_1",
      "rolle": "dilara",
      "runde": 2,
      "nr": 1,
      "partner": "leyla",
      "thema": "Nach dem Knall",
      "ziel": "Ich will wissen, ob nach dem Knall jemand auffällig war.",
      "preisgabe": [],
      "stichpunkte": [
        "Nach dem Knall war alles dunkel.",
        "Ist dir danach jemand aufgefallen?"
      ]
    }
  ]
}
