{
  "settingId": "spuk_im_schlosskeller",
  "bereich": "gespraech",
  "hinweis": "Tischgespräche Runde 3, Besetzungsplätze 5 bis 8 (A-051): je Rolle eines, Stichpunkte statt Prosa, ohne den Detektiv.",
  "eintraege": [
    {
      "id": "g_leyla_3_1",
      "rolle": "leyla",
      "runde": 3,
      "nr": 1,
      "partner": "baran",
      "thema": "Jeder spricht für sich",
      "ziel": "Ich will Ahmet schützen, bis er selbst redet.",
      "preisgabe": [],
      "stichpunkte": [
        "Jeder soll selbst sagen, was er weiß.",
        "Was hast du im Dunkeln mitbekommen?"
      ]
    },
    {
      "id": "g_emine_3_1",
      "rolle": "emine",
      "runde": 3,
      "nr": 1,
      "partner": "fatma",
      "thema": "Wir zwei",
      "ziel": "Ich will, dass sich niemand allein gelassen fühlt.",
      "preisgabe": [],
      "stichpunkte": [
        "Du kannst mir alles sagen.",
        "Ich halte zu dir, versprochen."
      ]
    },
    {
      "id": "g_tim_3_1",
      "rolle": "tim",
      "runde": 3,
      "nr": 1,
      "partner": "can",
      "thema": "Was im Dunkeln passiert ist",
      "ziel": "Ich will, dass niemand genauer auf mich schaut.",
      "preisgabe": [],
      "stichpunkte": [
        "Was hast du im Dunkeln eigentlich gemacht?",
        "Ich kenn mich mit Strom aus, sonst nichts."
      ]
    },
    {
      "id": "g_johanna_3_1",
      "rolle": "johanna",
      "runde": 3,
      "nr": 1,
      "partner": "ahmet",
      "thema": "Ehrlich bleiben",
      "ziel": "Ich will ehrlich bleiben und trotzdem nichts ausplaudern.",
      "preisgabe": [],
      "stichpunkte": [
        "Ich lüge niemanden an.",
        "Jetzt bist du dran mit Reden."
      ]
    }
  ]
}
